{
  "schema_version": "1.0",
  "blueprint_id": "mhf4u-unit1-functions-rates-researched-v1",
  "created_at": "2026-09-29T03:59:00Z",
  "title": "MHF4U Unit 1: Functions and Rates of Change - researched practice pattern",
  "subject": "Math",
  "grade_level": "12",
  "course_code": "MHF4U",
  "curriculum": "Ontario Curriculum, Grades 11 and 12: Mathematics (2007), Advanced Functions",
  "unit": {
    "unit_id": "unit-1",
    "unit_name": "Introduction to Functions and Rates of Change",
    "chapter_refs": [
      "Nelson 1.1-1.6",
      "Nelson 2.1",
      "Nelson 2.2",
      "Nelson 2.5"
    ],
    "learning_goals": [
      "Describe functions through equations, graphs, domains, ranges, and interval notation",
      "Analyze absolute value, parent, transformed, inverse, and piecewise functions",
      "Calculate and interpret average rate of change and estimate instantaneous rate of change"
    ]
  },
  "source_files": [
    {
      "file_name": "Unit-1-IndexSheet.jpeg",
      "file_type": "other",
      "path": "data/12-AdvancedFunctions/Unit-1-IndexSheet.jpeg",
      "notes": "Observed lesson scope and 15-class sequence"
    },
    {
      "file_name": "Unit-1-Generalized-Content.txt",
      "file_type": "txt",
      "path": "data/12-AdvancedFunctions/Unit-1/Unit-1-Generalized-Content.txt",
      "notes": "Content summary from selected Nelson lessons"
    },
    {
      "file_name": "Ontario Curriculum Grades 11 and 12 Mathematics",
      "file_type": "pdf",
      "path": "https://www.edu.gov.on.ca/eng/curriculum/secondary/math1112currb.pdf",
      "notes": "MHF4U rates-of-change expectations and four achievement categories"
    },
    {
      "file_name": "Public MHF4U Unit 1 test preview",
      "file_type": "other",
      "path": "https://www.coursehero.com/file/86519856/Test-1pdf/",
      "notes": "Unofficial uploaded example with closely matching topic list and K/U, T/I, C, A tagging; used only for pattern signals, never copied"
    },
    {
      "file_name": "Ontario MHF4U course outline",
      "file_type": "pdf",
      "path": "https://schoolweb.tdsb.on.ca/Portals/foresthill/docs/MHF4U1%20Course%20Outline.pdf",
      "notes": "School example; demonstrates local category weighting and a different Unit 1 sequence"
    }
  ],
  "analysis_summary": {
    "confidence": 0.72,
    "observed_patterns": [
      "The supplied index lists 1.1-1.6, 2.1, 2.2, and 2.5, ending with a task, review, and test",
      "Ontario mathematics uses Knowledge/Understanding, Thinking, Communication, and Application achievement categories",
      "A public Unit 1 example with the same topic sequence allocates marks to those four categories and uses constructed-response graphing and rate questions",
      "A school course outline uses different category weights and labels Unit 1 differently, showing local variation"
    ],
    "inferred_patterns": [
      "Use four balanced sections as a defensible practice-test format; equal 15-mark sections are a design choice, not a province-wide rule",
      "Use 60 marks and 90 minutes as a classroom-style practice target, not an official requirement",
      "Progress from direct recognition to transformations, explanations, and contextual rate problems"
    ],
    "notes": "This blueprint is researched and inferred because the student's actual teacher test is unavailable. The publicly posted example is not verified as an official board standard. Do not claim the output predicts the real exam."
  },
  "structure": {
    "test_type": "original practice unit test",
    "duration_minutes": 90,
    "total_marks": 60,
    "sections": [
      {
        "section_id": "A",
        "title": "Knowledge and Understanding",
        "order": 1,
        "instructions": "Answer all three questions; show concise work.",
        "question_types": [
          "short answer",
          "domain/range",
          "classification"
        ],
        "num_questions": 3,
        "marks": 15,
        "skills_targeted": [
          "facts",
          "basic procedures"
        ]
      },
      {
        "section_id": "B",
        "title": "Thinking",
        "order": 2,
        "instructions": "Show reasoning and key steps.",
        "question_types": [
          "multi-step transformation",
          "inverse",
          "piecewise analysis"
        ],
        "num_questions": 3,
        "marks": 15,
        "skills_targeted": [
          "strategic reasoning",
          "connections"
        ]
      },
      {
        "section_id": "C",
        "title": "Communication",
        "order": 3,
        "instructions": "Use clear mathematical explanations and notation.",
        "question_types": [
          "error analysis",
          "rate explanation",
          "concept justification"
        ],
        "num_questions": 3,
        "marks": 15,
        "skills_targeted": [
          "explanation",
          "representation",
          "notation"
        ]
      },
      {
        "section_id": "D",
        "title": "Application",
        "order": 4,
        "instructions": "Model and interpret each situation with units.",
        "question_types": [
          "contextual piecewise model",
          "projectile rate",
          "contextual rate model"
        ],
        "num_questions": 3,
        "marks": 15,
        "skills_targeted": [
          "modelling",
          "contextual interpretation"
        ]
      }
    ],
    "ordering_rules": [
      "Twelve numbered questions, each worth 5 marks",
      "Sections A-D progress from routine to contextual work"
    ]
  },
  "topic_distribution": [
    {
      "topic": "Functions, domain, range, and interval notation",
      "weight_pct": 12,
      "question_forms": [
        "short answer",
        "explanation"
      ]
    },
    {
      "topic": "Absolute value",
      "weight_pct": 8,
      "question_forms": [
        "graph features"
      ]
    },
    {
      "topic": "Graph properties and symmetry",
      "weight_pct": 8,
      "question_forms": [
        "classification"
      ]
    },
    {
      "topic": "Transformations",
      "weight_pct": 17,
      "question_forms": [
        "point mapping",
        "error analysis"
      ]
    },
    {
      "topic": "Inverse relations/functions",
      "weight_pct": 17,
      "question_forms": [
        "algebraic inverse",
        "concept explanation"
      ]
    },
    {
      "topic": "Piecewise functions",
      "weight_pct": 16,
      "question_forms": [
        "continuity and range",
        "contextual model"
      ]
    },
    {
      "topic": "Average and instantaneous rates of change",
      "weight_pct": 22,
      "question_forms": [
        "table",
        "equation",
        "interpretation"
      ]
    }
  ],
  "difficulty_profile": {
    "easy_pct": 30,
    "medium_pct": 50,
    "hard_pct": 20,
    "progression_notes": [
      "Direct features first",
      "Multi-step analysis second",
      "Explanations and applications last"
    ],
    "cognitive_skills": [
      "recognize",
      "calculate",
      "justify",
      "model",
      "interpret"
    ]
  },
  "question_style": {
    "stem_styles": [
      "State and justify",
      "Determine",
      "Explain",
      "Interpret in context"
    ],
    "response_formats": [
      "exact values",
      "interval notation",
      "labelled sketch",
      "worked calculation",
      "sentence with units"
    ],
    "common_verbs": [
      "state",
      "determine",
      "sketch",
      "explain",
      "interpret"
    ],
    "wording_tone": "clear Ontario Grade 12 classroom style",
    "diagram_expectations": [
      "graphs show axes, intercepts, and open or closed endpoints where relevant"
    ],
    "answer_style_expectations": [
      "show steps",
      "state restrictions",
      "include units",
      "write conclusions"
    ]
  },
  "trap_patterns": [
    {
      "trap_type": "endpoint inclusion",
      "description": "Confusing open and closed interval or piecewise endpoints",
      "frequency": "medium"
    },
    {
      "trap_type": "horizontal transformation",
      "description": "Using k instead of 1/k in a point mapping",
      "frequency": "medium"
    },
    {
      "trap_type": "inverse misconception",
      "description": "Confusing inverse with reciprocal or omitting a domain restriction",
      "frequency": "medium"
    },
    {
      "trap_type": "rate interpretation",
      "description": "Confusing secant slope with tangent slope or omitting units",
      "frequency": "medium"
    }
  ],
  "generation_rules": {
    "preserve_structure": true,
    "reuse_prohibited": true,
    "variation_policy": "Change all numbers, contexts, and wording while preserving assessed skills and four-category structure.",
    "freshness_requirements": [
      "Original questions",
      "No verbatim textbook or public sample stems"
    ],
    "constraints": [
      "Stay within the supplied Unit 1 index",
      "No derivative rules required",
      "Provide a separate worked key"
    ]
  },
  "memory_metadata": {
    "tags": [
      "MHF4U",
      "Unit 1",
      "functions",
      "rates of change",
      "researched pattern"
    ],
    "summary_for_retrieval": "Inferred 60-mark MHF4U Unit 1 practice format with four achievement categories and supplied index scope."
  },
  "cumulative_metadata": {
    "eligible_for_cumulative": true,
    "recommended_merge_tags": [
      "functions",
      "rates of change"
    ]
  },
  "subject_extensions": {
    "notation_rules": [
      "Use f^-1 for inverse and 1/f for reciprocal",
      "Use interval notation with correct endpoint inclusion"
    ],
    "graph_types": [
      "absolute value",
      "transformed parent",
      "piecewise"
    ],
    "calculation_modes": [
      "algebraic",
      "tabular secant estimate",
      "graphical reasoning"
    ],
    "topic_specific_constraints": [
      "Assess average and instantaneous rates without formal differentiation rules"
    ]
  }
}
